{
  "schemaVersion" : "matching.m12.command-history.v1",
  "status" : "PASS",
  "implementation" : "REAL_AERON_CHILD_PROCESSES",
  "sourceArtifact" : "m12-command-history.json",
  "executionScope" : "REAL_AERON_CHILD_PROCESSES",
  "corpusSha256" : "c3190603f81e8bdbb64c9c85e0cf8c519ba8073b5ac8f8f702067dda7a16b30e",
  "identityCount" : 66,
  "invocationCount" : 85,
  "ingressAccepted" : 84,
  "acknowledged" : 82,
  "unknown" : 2,
  "notSubmitted" : 1,
  "memberProcessStarts" : 6,
  "externalForceStops" : 3,
  "finalNextApplicationSequence" : 67,
  "appliedUnknownAttemptOrdinal" : 42,
  "appliedUnknownObservedOnAllMembersBeforeLeaderKill" : true,
  "appliedUnknownExpectedNextApplicationSequence" : 34,
  "appliedUnknownExpectedIdentityCount" : 33,
  "appliedUnknownMembersBeforeLeaderKill" : [ {
    "memberId" : 0,
    "processId" : 36322,
    "role" : "FOLLOWER",
    "electionState" : "CLOSED",
    "leadershipTermId" : 0,
    "commitPosition" : 12064,
    "logPosition" : 12064,
    "nextApplicationSequence" : 34,
    "identityCount" : 33,
    "semanticStateDigest" : "4bf623fec98933e47de2b8f9a1c88c6c17584a78bbf03a0b056240b0e84eefea",
    "identityResultDigest" : "1a2a9e355edf836a2e3475bfef0b335fcc47e9572e7eb2bbf76ccb044dfc3d52",
    "componentErrorCount" : 0,
    "diagnosticWarningCount" : 0,
    "droppedDiagnosticWarnings" : 0,
    "diagnosticWarnings" : [ ]
  }, {
    "memberId" : 1,
    "processId" : 36323,
    "role" : "LEADER",
    "electionState" : "CLOSED",
    "leadershipTermId" : 0,
    "commitPosition" : 12064,
    "logPosition" : 12064,
    "nextApplicationSequence" : 34,
    "identityCount" : 33,
    "semanticStateDigest" : "4bf623fec98933e47de2b8f9a1c88c6c17584a78bbf03a0b056240b0e84eefea",
    "identityResultDigest" : "1a2a9e355edf836a2e3475bfef0b335fcc47e9572e7eb2bbf76ccb044dfc3d52",
    "componentErrorCount" : 0,
    "diagnosticWarningCount" : 0,
    "droppedDiagnosticWarnings" : 0,
    "diagnosticWarnings" : [ ]
  }, {
    "memberId" : 2,
    "processId" : 36324,
    "role" : "FOLLOWER",
    "electionState" : "CLOSED",
    "leadershipTermId" : 0,
    "commitPosition" : 12064,
    "logPosition" : 12064,
    "nextApplicationSequence" : 34,
    "identityCount" : 33,
    "semanticStateDigest" : "4bf623fec98933e47de2b8f9a1c88c6c17584a78bbf03a0b056240b0e84eefea",
    "identityResultDigest" : "1a2a9e355edf836a2e3475bfef0b335fcc47e9572e7eb2bbf76ccb044dfc3d52",
    "componentErrorCount" : 0,
    "diagnosticWarningCount" : 0,
    "droppedDiagnosticWarnings" : 0,
    "diagnosticWarnings" : [ ]
  } ],
  "attempts" : [ {
    "ordinal" : 1,
    "phase" : "PRE_OFFER_IS_NOT_SUBMITTED",
    "identityIndex" : 1,
    "canonicalEnvelopeSha256" : "0f8f0c4bfbb39b75c742056015aa671523bdbf60536c4548035267e2fb8b96af",
    "commandId" : "ef658e5a-b5cb-df35-3ea3-62235c8d81db",
    "correlationId" : "20bd8bdd-4e66-8db2-162a-50d9fcdb946e",
    "ingressAccepted" : false,
    "outcome" : "NOT_SUBMITTED",
    "trustedResponseObserved" : false,
    "responseCorrelationId" : null,
    "responseStatus" : null,
    "applicationSequence" : null,
    "resultDigest" : null,
    "businessEffectApplied" : false,
    "retryOfAttemptOrdinal" : null,
    "authorityTerm" : 0,
    "authorityLeaderId" : 1,
    "responseAcceptedUnderCurrentClientAuthority" : false,
    "noQuorumWindow" : false,
    "timeoutClassifiedAsBusinessRejection" : false
  }, {
    "ordinal" : 2,
    "phase" : "PRE_FAILOVER_ACKNOWLEDGED_NEW_32",
    "identityIndex" : 1,
    "canonicalEnvelopeSha256" : "0f8f0c4bfbb39b75c742056015aa671523bdbf60536c4548035267e2fb8b96af",
    "commandId" : "ef658e5a-b5cb-df35-3ea3-62235c8d81db",
    "correlationId" : "f9f6851a-24d7-6dbf-f4d1-e247e9e2126b",
    "ingressAccepted" : true,
    "outcome" : "ACKNOWLEDGED",
    "trustedResponseObserved" : true,
    "responseCorrelationId" : "f9f6851a-24d7-6dbf-f4d1-e247e9e2126b",
    "responseStatus" : "NEW_APPLIED",
    "applicationSequence" : 1,
    "resultDigest" : "a41f6066ddfa40ea92286d20e9def402456086c3536932785221a21b77948495",
    "businessEffectApplied" : true,
    "retryOfAttemptOrdinal" : null,
    "authorityTerm" : 0,
    "authorityLeaderId" : 1,
    "responseAcceptedUnderCurrentClientAuthority" : true,
    "noQuorumWindow" : false,
    "timeoutClassifiedAsBusinessRejection" : false
  }, {
    "ordinal" : 3,
    "phase" : "PRE_FAILOVER_ACKNOWLEDGED_NEW_32",
    "identityIndex" : 2,
    "canonicalEnvelopeSha256" : "140ce1ba6d765d885ce549ed79680421caed2c92eeaa98c0029412f325ca1668",
    "commandId" : "75a12915-0455-406a-54c1-7a2ea1e4ee96",
    "correlationId" : "8dee4e7b-9300-07a9-fe30-7a36e8ef9989",
    "ingressAccepted" : true,
    "outcome" : "ACKNOWLEDGED",
    "trustedResponseObserved" : true,
    "responseCorrelationId" : "8dee4e7b-9300-07a9-fe30-7a36e8ef9989",
    "responseStatus" : "NEW_APPLIED",
    "applicationSequence" : 2,
    "resultDigest" : "365cb826d56fd8667fada3f05a19c06362bd8035e1a43be8d91d01e11b80ee73",
    "businessEffectApplied" : true,
    "retryOfAttemptOrdinal" : null,
    "authorityTerm" : 0,
    "authorityLeaderId" : 1,
    "responseAcceptedUnderCurrentClientAuthority" : true,
    "noQuorumWindow" : false,
    "timeoutClassifiedAsBusinessRejection" : false
  }, {
    "ordinal" : 4,
    "phase" : "PRE_FAILOVER_ACKNOWLEDGED_NEW_32",
    "identityIndex" : 3,
    "canonicalEnvelopeSha256" : "e251bc9bc9e23e451f08c6aa03b80eedecd03902113005332188cf8098c0ba2f",
    "commandId" : "46ecc830-e638-d488-5e35-bdb900d0f5a4",
    "correlationId" : "4c77d7eb-ecc4-77b8-007d-36706dd9c76d",
    "ingressAccepted" : true,
    "outcome" : "ACKNOWLEDGED",
    "trustedResponseObserved" : true,
    "responseCorrelationId" : "4c77d7eb-ecc4-77b8-007d-36706dd9c76d",
    "responseStatus" : "NEW_APPLIED",
    "applicationSequence" : 3,
    "resultDigest" : "176f59f9068cb8f881f9e28152a7332d2f66de7355c0f0d37324070a79e5b1f9",
    "businessEffectApplied" : true,
    "retryOfAttemptOrdinal" : null,
    "authorityTerm" : 0,
    "authorityLeaderId" : 1,
    "responseAcceptedUnderCurrentClientAuthority" : true,
    "noQuorumWindow" : false,
    "timeoutClassifiedAsBusinessRejection" : false
  }, {
    "ordinal" : 5,
    "phase" : "PRE_FAILOVER_ACKNOWLEDGED_NEW_32",
    "identityIndex" : 4,
    "canonicalEnvelopeSha256" : "381cc5f9dc2eaf0a69c309723521b6ae95110c6b823fe6b31fa9ebf40b330054",
    "commandId" : "3794f8dd-74b6-a072-90de-c7e5b366f1f1",
    "correlationId" : "bbaf96c5-3362-104b-e5b4-e544b8098b07",
    "ingressAccepted" : true,
    "outcome" : "ACKNOWLEDGED",
    "trustedResponseObserved" : true,
    "responseCorrelationId" : "bbaf96c5-3362-104b-e5b4-e544b8098b07",
    "responseStatus" : "NEW_APPLIED",
    "applicationSequence" : 4,
    "resultDigest" : "f02f7f67f0c10bf7622d2ba5212b515604af37c82eeb795c43ce0da302159bb4",
    "businessEffectApplied" : true,
    "retryOfAttemptOrdinal" : null,
    "authorityTerm" : 0,
    "authorityLeaderId" : 1,
    "responseAcceptedUnderCurrentClientAuthority" : true,
    "noQuorumWindow" : false,
    "timeoutClassifiedAsBusinessRejection" : false
  }, {
    "ordinal" : 6,
    "phase" : "PRE_FAILOVER_ACKNOWLEDGED_NEW_32",
    "identityIndex" : 5,
    "canonicalEnvelopeSha256" : "353917c2e3a727c5d8be367b73526b1cc23cbdb788af461417f4467f7a212183",
    "commandId" : "eaad903b-9f7d-efbb-3b35-d5a607b1c1da",
    "correlationId" : "712ec41d-dbb6-6889-eee6-4182c7c6d552",
    "ingressAccepted" : true,
    "outcome" : "ACKNOWLEDGED",
    "trustedResponseObserved" : true,
    "responseCorrelationId" : "712ec41d-dbb6-6889-eee6-4182c7c6d552",
    "responseStatus" : "NEW_APPLIED",
    "applicationSequence" : 5,
    "resultDigest" : "c5fb227e6724445e322c93181e34ffff2bd5950af2c65ce04d49d302fdfbee8e",
    "businessEffectApplied" : true,
    "retryOfAttemptOrdinal" : null,
    "authorityTerm" : 0,
    "authorityLeaderId" : 1,
    "responseAcceptedUnderCurrentClientAuthority" : true,
    "noQuorumWindow" : false,
    "timeoutClassifiedAsBusinessRejection" : false
  }, {
    "ordinal" : 7,
    "phase" : "PRE_FAILOVER_ACKNOWLEDGED_NEW_32",
    "identityIndex" : 6,
    "canonicalEnvelopeSha256" : "15970a7990356d806d1d659bfa20c312d08e7f64055650bcc0e6f37feeda400e",
    "commandId" : "038d9b02-7152-6efc-68be-3ad1e92ed431",
    "correlationId" : "5662f175-90aa-e8f4-9260-c4400ffd10f8",
    "ingressAccepted" : true,
    "outcome" : "ACKNOWLEDGED",
    "trustedResponseObserved" : true,
    "responseCorrelationId" : "5662f175-90aa-e8f4-9260-c4400ffd10f8",
    "responseStatus" : "NEW_APPLIED",
    "applicationSequence" : 6,
    "resultDigest" : "40f97bc53c73fd98afcb562ab6be7088611589859c101e26366ba19056e1e8e7",
    "businessEffectApplied" : true,
    "retryOfAttemptOrdinal" : null,
    "authorityTerm" : 0,
    "authorityLeaderId" : 1,
    "responseAcceptedUnderCurrentClientAuthority" : true,
    "noQuorumWindow" : false,
    "timeoutClassifiedAsBusinessRejection" : false
  }, {
    "ordinal" : 8,
    "phase" : "PRE_FAILOVER_ACKNOWLEDGED_NEW_32",
    "identityIndex" : 7,
    "canonicalEnvelopeSha256" : "798361492b31968c8f5602289c55601ab57378d4dd79b44ddddcddba27b19c25",
    "commandId" : "e7bf7756-19d6-91a8-20bd-8bdd4e668db2",
    "correlationId" : "63b3e8ea-1e2e-7643-e3c2-ac4e3513b965",
    "ingressAccepted" : true,
    "outcome" : "ACKNOWLEDGED",
    "trustedResponseObserved" : true,
    "responseCorrelationId" : "63b3e8ea-1e2e-7643-e3c2-ac4e3513b965",
    "responseStatus" : "NEW_APPLIED",
    "applicationSequence" : 7,
    "resultDigest" : "e5c51c801aa52fae4cb3b1765368cfffebf81335076b1878596bd59ef760392a",
    "businessEffectApplied" : true,
    "retryOfAttemptOrdinal" : null,
    "authorityTerm" : 0,
    "authorityLeaderId" : 1,
    "responseAcceptedUnderCurrentClientAuthority" : true,
    "noQuorumWindow" : false,
    "timeoutClassifiedAsBusinessRejection" : false
  }, {
    "ordinal" : 9,
    "phase" : "PRE_FAILOVER_ACKNOWLEDGED_NEW_32",
    "identityIndex" : 8,
    "canonicalEnvelopeSha256" : "2791e77907f09b9b6b6c1f9faffd030abfc2121c58b28e280373093633d99231",